{
    "$schema": "https://json-schema.org/draft/2020-12/schema",
    "$id": "https://mandolin.github.io/HIA-Documentation/schemas/documentation-producer-result-0.1.0-draft.schema.json",
    "title": "Documentation Producer Result",
    "type": "object",
    "additionalProperties": false,
    "required": [
        "contract",
        "contractVersion",
        "producer",
        "status",
        "artifacts",
        "diagnostics"
    ],
    "properties": {
        "contract": {
            "const": "documentation-producer-result"
        },
        "contractVersion": {
            "const": "0.1.0-draft"
        },
        "producer": {
            "type": "object",
            "additionalProperties": false,
            "required": [
                "id",
                "version"
            ],
            "properties": {
                "id": {
                    "type": "string",
                    "minLength": 1,
                    "pattern": "^[a-z0-9][a-z0-9._-]*$"
                },
                "version": {
                    "type": "string",
                    "minLength": 1
                }
            }
        },
        "status": {
            "enum": [
                "success",
                "partial",
                "failed"
            ]
        },
        "artifacts": {
            "type": "array",
            "items": {
                "type": "object",
                "additionalProperties": false,
                "required": [
                    "id",
                    "kind",
                    "path"
                ],
                "properties": {
                    "id": {
                        "type": "string",
                        "minLength": 1,
                        "pattern": "^[a-z0-9][a-z0-9._-]*$"
                    },
                    "kind": {
                        "type": "string",
                        "minLength": 1,
                        "pattern": "^[a-z0-9][a-z0-9._/-]*$"
                    },
                    "path": {
                        "type": "string",
                        "minLength": 1
                    },
                    "contract": {
                        "type": "string",
                        "minLength": 1
                    },
                    "contractVersion": {
                        "type": "string",
                        "minLength": 1
                    },
                    "format": {
                        "type": "string",
                        "minLength": 1
                    },
                    "language": {
                        "type": "string",
                        "minLength": 1
                    },
                    "mediaType": {
                        "type": "string",
                        "minLength": 1
                    },
                    "profileIds": {
                        "type": "array",
                        "uniqueItems": true,
                        "items": {
                            "type": "string",
                            "minLength": 1,
                            "pattern": "^[a-z0-9][a-z0-9._-]*$"
                        }
                    }
                }
            }
        },
        "diagnostics": {
            "type": "array",
            "items": {
                "type": "object",
                "additionalProperties": false,
                "required": [
                    "code",
                    "message",
                    "severity"
                ],
                "properties": {
                    "code": {
                        "type": "string",
                        "minLength": 1
                    },
                    "message": {
                        "type": "string",
                        "minLength": 1
                    },
                    "severity": {
                        "enum": [
                            "error",
                            "warning",
                            "info"
                        ]
                    },
                    "data": {
                        "type": "object"
                    },
                    "metadata": {
                        "type": "object"
                    },
                    "source": {
                        "type": "object",
                        "additionalProperties": true,
                        "properties": {
                            "path": {
                                "type": "string",
                                "minLength": 1
                            }
                        }
                    },
                    "path": {
                        "type": "string",
                        "minLength": 1
                    },
                    "targetPath": {
                        "type": "string",
                        "minLength": 1
                    }
                }
            }
        }
    }
}
